image_id,caption
100844.jpg,"a row of green books titled "" manuals of the united states, "" featuring various legal terms and titles on a wooden shelf."
100845.jpg,"billboard promoting the san tan county fair, featuring vintage vehicles and a backdrop of clear blue skies and trees."
100846.jpg,"a man with a shaved head wears a white chef ' s coat, standing beside a green bottle."
100847.jpg,"a child with short hair plays a video game on a computer monitor, focused on the screen."
100848.jpg,"a collection of six vintage bottles of mr. martini, labeled "" premium martini, "" arranged in a wooden display."
100849.jpg,"the image features a row of toy figures resembling abraham lincoln, displayed in a display case."
100850.jpg,"a black box with a red card inside, featuring a welcome message and a red insert inside."
100851.jpg,"a collection of various books, including titles by norman risser and others, displayed on a textured surface."
100852.jpg,"the image features four colorful tin cans, prominently displaying coca - cola and lumine themes, with vibrant designs and vibrant branding."
100853.jpg,"a tudor watch on a wrist, featuring a black dial, luminous markers, and a stainless steel band."
100854.jpg,"a vintage book cover titled "" resurrection tolstoy, "" featuring intricate green and brown design elements on a dark background."
100855.jpg,"the image displays a bottle of fennelian vodka, labeled with various ingredients and specifications, indicating its flavor and alcohol content."
100856.jpg,the image shows a paper cutting mat with a handwritten numerical table and a printed table number.
100857.jpg,"a vintage commodore lx keyboard displayed on a table, featuring a compact design with a standard keyboard layout."
100858.jpg,"a group of women in sports uniforms huddles together, preparing for a volleyball match."
100859.jpg,"a wii console sits on a table, accompanied by gaming accessories and a gaming bag."
100860.jpg,"a large, white building with a prominent sign, surrounded by trees and a pathway, featuring a monument in front."
100861.jpg,"a large, historic building with a clock tower, surrounded by greenery and people walking on the pathway."
100862.jpg,the image shows an open book with handwritten notes and a blue u. s. army service identification sticker.
100863.jpg,"a display shelf labeled "" low prices "" features stacked products, with a price sign indicating 99 cents."
100864.jpg,"a person is filming a scene on a computer monitor, with a camera recording a scene in a restaurant setting."
100865.jpg,"a large screen displays the "" welcome "" logo, with a red x symbol at the bottom, set in a dimly lit space."
100866.jpg,"a man and a woman play table tennis indoors, with a racket and a ball in play."
100867.jpg,"a blackberry tablet displays a collage of various apps, including video feeds and social media feeds."
100868.jpg,"a man walks across a busy street lined with yellow taxis, surrounded by tall buildings and urban architecture."
100869.jpg,"the image shows a newspaper article discussing the impact of a tunnel strike in channel 4, dated june 27, 2010."
100870.jpg,"a shelf displays various books, including titles on management, business, and entrepreneurship, organized neatly."
100871.jpg,"a group of people seated at a table, with one woman speaking, while others applaud and enjoy food."
100872.jpg,"a tall, ornate building features a prominent clock tower and a prominent red brick facade."
100873.jpg,"the image shows a grocery store aisle with jars of cookies and jars of candies, labeled for sale."
100874.jpg,"a blue and white airplane is landing on a grassy runway, surrounded by trees and a hazy sky."
100875.jpg,"the image shows a convenience store shelf filled with various colorful candy bars, including cadbury and cadbury chocolates."
100876.jpg,"a large wall clock displays roman numerals, mounted on a building, labeled "" halpikke jeweller. """
100877.jpg,"a green bottle of chateau guie - chac wine, labeled "" chateau gurd, "" sits on a table."
100878.jpg,"a television studio with large screens displaying colorful graphics, featuring a cameraman filming a scene."
100879.jpg,"a man wearing a sports jersey with "" keeper shakuwaks "" and number 2 watches a crowd at a baseball game."
100880.jpg,"several boats are docked in a calm harbor, surrounded by calm waters and foggy skies."
100881.jpg,"a vintage billboard displays "" bintang push - delux, "" featuring a star and the text "" climb - to - fame. """
100882.jpg,"four cigars are arranged on a dark surface, each labeled with different brands and labels."
100883.jpg,"a television screen displays a presenter presenting a 220 message, with a blue background and a black keyboard below."
100884.jpg,"a busy convenience store features various bread products, with people browsing and shopping in a busy environment."
100885.jpg,"a poster listing draft beer options, including names and types, with a focus on quality and competitive ratings."
100886.jpg,"a sleek, brown leather - bound device case with usb ports is positioned on a surface."
100887.jpg,"a woman in a dark sweater cooks in a kitchen, using a spatula to stir food on the stove."
100888.jpg,"three individuals are engaged in a gym setting, with one lifting a barbell, while another observes nearby."
100889.jpg,"a starbucks coffee cup filled with whipped cream, chocolate pieces, and sprinkles, topped with a dark chocolate sauce."
100890.jpg,"a glass of dark beer sits next to a labeled bottle, labeled "" trappist, "" showcasing a rich color and frothy head."
100891.jpg,"the image shows a vintage typewriter with a keyboard, positioned on a surface, showcasing its vintage design."
100892.jpg,"the image features various beer bottles, including a brown bottle with a baby bottle cap, among other smaller bottles."
100893.jpg,"a vintage cassette tape labeled "" low noise greatest bushhit "" with a purple and white design, featuring two small black eyes."
100894.jpg,"a red stop sign with the word "" berheit "" prominently displayed, featuring the word "" low west loan "" prominently displayed."
100895.jpg,"two women play football indoors, one in a white jersey and the other in blue, dribbling a ball while the other defends."
100896.jpg,"a hand holds a bottle of "" dobby ' s dobby ' s export beer, "" featuring an artistic label with a smiling face."
100897.jpg,"a traffic light displays a green signal, indicating no entry for vehicles, with palm trees in the background."
100898.jpg,"a white remote control featuring various buttons for navigation, volume, and settings, with a simple design."
100899.jpg,"a smiling black and tan dog with a collar, showing its tongue, is displayed on a postage stamp."
100900.jpg,"a football match in progress, with players in white and red jerseys on the field, and a crowd in the stands."
100901.jpg,a digital watch is displayed on a surface beside a digital screen displaying time and a date.
100902.jpg,"a mobile phone displays a map with the text "" never get lost in the big apple, "" featuring a google maps logo."
100903.jpg,"a stack of books on a shelf, featuring titles like "" cyberville "" and "" community building, "" showcasing various genres and titles."
100904.jpg,"the image shows a silver coin featuring a knight on horseback, surrounded by ornate inscriptions and inscriptions."
100905.jpg,"the image shows a black box labeled "" samsung galaxy s4, "" with a shipping label and a product box nearby."
100906.jpg,"a truck and a van are traveling on a highway, with utility poles and a traffic light visible."
100907.jpg,"a no - entry sign and a traffic sign for vehicles with a french flag, set against a rocky terrain background."
100908.jpg,"the image features three glass bottles, including one with a cork, alongside a sign discussing the office culture."
100909.jpg,"a collection of various canadian coins arranged on a red background, featuring various denominations and designs."
100910.jpg,"a street view featuring brick buildings, a car parked, and utility poles lining the road."
100911.jpg,"a row of vintage books titled "" origin, origin, origin, origin, origin, origin, origin, origin, origin, origin, origin, origin"
100912.jpg,"a smiling boy in a red sports jacket stands near a baseball field, surrounded by a net and a glove."
100913.jpg,"a white bosch food processor with a glass container containing colorful vegetables, positioned on a kitchen countertop."
100914.jpg,"a glass of amber beer sits next to a can of soda, with a colorful background."
100915.jpg,"a group of athletes in sports uniforms, with one wearing a green jersey and number 1, cheering in a gym setting."
100916.jpg,"a construction site scene featuring a truck, warning signs, and barriers, indicating danger and hot work."
100917.jpg,"two military personnel in camouflage uniforms converse, surrounded by flags and military insignia. one man is adjusting his uniform."
100918.jpg,"a variety of whiskey bottles and glasses are displayed on a bar, showcasing various brands and types."
100919.jpg,"a decorative wall plaque featuring a chocolate - colored chocolate - covered dessert, labeled "" chocolate mousse, "" with a crocted design."
100920.jpg,"abstract poster featuring the text "" elles & centripponproud "" in bold yellow letters, surrounded by vibrant colors."
100921.jpg,"a red stop sign is prominently displayed, with a street sign for lancstfa ave and a green street sign for old dr. 22."
100922.jpg,"three young women are seated on a stage, wearing casual sports uniforms. one woman is speaking, while the other is holding a baseball bat."
100923.jpg,"a yellow taxi is parked near a hotel entrance, with trees and a decorative lamp post in the foreground."
100924.jpg,"a person in a blue jacket is adjusting a white lockery labeled "" lg "" at a manufacturing facility."
100925.jpg,"billboard promoting cross training, featuring a logo and contact information for registration details."
100926.jpg,"a boy sits in a bowling chair, reading a game, with a bowling alley in the background."
100927.jpg,"a vintage book titled "" the millennium of the gods "" by william gibson, featuring ornate gold lettering and a purple cover."
100928.jpg,"the image features a book cover titled "" wilileane, "" depicting a woman with dark hair and a red jacket, set against a scenic background."
100929.jpg,"the image features a yellow shirt, various items, including snacks, drinks, and a credit system, arranged on a carpet."
100930.jpg,"a yellow taxi drives past a brightly lit theater marquee, with pedestrians and colorful signage in the background."
100931.jpg,"the image shows a highway sign displaying directions to south and west, with various traffic signs indicating directions and distances."
100932.jpg,"a woman with blonde hair wears a floral headband and a floral dress, standing near a yellow food truck."
100933.jpg,"three wine bottles are displayed on a shelf, featuring labels for "" running club "" and "" clyne, "" showcasing a mix of white and red wines"
100934.jpg,"the image features a promotional poster for the semagwyn electric sound system, highlighting its awards 2011 selection."
100935.jpg,"a close - up of a keyboard rests among stacked tin cans of "" the fourth shift "" on a cluttered surface."
100936.jpg,"a man wearing a baseball uniform and cap speaks into a mobile phone, with a backdrop featuring logos and text."
100937.jpg,"a stylish tissot watch featuring a black dial, silver case, and leather strap, showcasing stylish fashion accessories."
100938.jpg,"a young boy in a blue baseball uniform stands on the field, holding a baseball glove, ready for play."
100939.jpg,"a man in a black jersey skates on ice, while another man in green skates nearby, both engaged in a dynamic skate routine."
100940.jpg,"a wooden cabinet with multiple drawers, featuring a lower drawer with a lower drawer, surrounded by unfinished furniture."
100941.jpg,"a silver coin featuring a dragon design, with the inscription "" republic of china "" and "" 2. """
100942.jpg,"a bottle of wine labeled "" white "" from seybelu, south africa, featuring a simple design and a clear label."
100943.jpg,"a man in a white shirt and blue tie speaks at a library event, surrounded by colorful posters and books."
100944.jpg,"a person wearing jeans and a jacket stands near a shopping bag, with a humorous sign nearby."
100945.jpg,"a sleek bottle labeled "" katari 90 "" is presented in an elegant box, showcasing a premium body care product."
100946.jpg,"a dark wine bottle labeled "" the squid ' s fist, "" featuring a colorful fish design and a green cap."
100947.jpg,"a green bottle of beck ' s beer stands upright on a wooden surface, illuminated by soft light."
100948.jpg,"two vintage posters display "" twelfth night "" at the village hall, showcasing historical themes and details about the film."
100949.jpg,"modern building with large glass windows, featuring a prominent sign and several bare trees in front."
100950.jpg,"a smiling woman holds two lg mobile phones, showcasing their features against a modern background."
100951.jpg,"the image shows a poster depicting a group of people engaged in a formal instructing session, with text indicating instructions."
100952.jpg,"a close - up of a rolex sea - dweller watch face, featuring a black dial, luminous markers, and a date display."
100953.jpg,"a circular medallion featuring a profile of a man, inscribed with "" yoyomoto koyo, "" dated 1826."
100954.jpg,"a freight train car with graffiti displays the word "" fear "" prominently on its side."
100955.jpg,"a blue scarf featuring the british flag and "" rfc "" text, with white fringes, resting on a dark surface."
100956.jpg,"a bottle of royal williams honey whiskey, featuring a golden liquid and a black cap, set against a wooden background."
100957.jpg,"two children are seated at a table, engaged with a project, while a water bottle is nearby."
100958.jpg,a football match scene with players in red and yellow jerseys competing for the ball on a grassy field.
100959.jpg,"two coffee cups sit on saucers, one with a creamy foam, accompanied by a cinnamon stick and a small dish."
100960.jpg,"a blue mercedes - benz parked in a grassy area, surrounded by other vehicles and vehicles in the background."
100961.jpg,"two male wrestlers compete on a mat, one in a purple uniform and the other in red, showcasing athleticism and teamwork."
100962.jpg,"the image shows a vehicle registration plate with the number "" xh 05 "" and the russian flag."
100963.jpg,"a man in glasses speaks at a conference table, with water bottles and a london 2012 logo visible."
100964.jpg,"book cover featuring "" midaq alley "" by mahub, with a minimalist design and green accents. title and author details are visible."
100965.jpg,"a vintage airplane with a blue and silver design is parked on a tarmac, surrounded by people and other aircraft."
100966.jpg,"a lineup of various moet & chandon champagne bottles, showcasing different labels and colors, showcasing elegant and elegant design."
100967.jpg,"poster promoting the "" programming with swift "" program, highlighting key features, including open source libraries and open source libraries."
100968.jpg,"the image shows a scoreboard at citizens bank park, featuring player yoshimura yamagure, with player stats and game information."
100969.jpg,"an lg smartphone displayed on a table, featuring a colorful home screen and various app icons, alongside a box and photo."
100970.jpg,a baseball player in a white uniform catches a ball while an umpire observes. an umpire observes the play.
100971.jpg,"the image shows two mobile phones : a samsung and a flip phone, both with physical keyboards and screens."
100972.jpg,"a boxing ring with boxing gloves and gloves, featuring signage indicating "" first fight "" and "" fermented, "" with a referee nearby."
100973.jpg,"an old envelope lies among various letters and addressed letters, including a letter addressed to "" ante postline. """
100974.jpg,"the image shows the cockpit of a sleek white aircraft, showcasing its cockpit and cockpit design."
100975.jpg,"a stack of books on a table includes titles on programming, programming, and programming, including "" good grief hunting "" and "" adventure award. """
100976.jpg,"a white and blue airplane with the name "" isal "" is parked on an airport tarmac, surrounded by cones and a yellow vehicle."
100977.jpg,"three vintage green and cream double - decker buses are parked side by side, showcasing classic design and classic style."
100978.jpg,a digital clock displays the time as 11 : 11 in a dimly lit setting.
100979.jpg,"a woman and a man enjoy a meal at a bar, with a bottle of wine in the background."
100980.jpg,"a sign points to a direction labeled "" schloss, "" with a scenic view of a cityscape in the background."
100981.jpg,"the image features four views of the imperial airship, showcasing its designs and specifications."
100982.jpg,"a man with a watch sits at a table, using a laptop and a laptop screen, surrounded by various devices."
100983.jpg,"a colorful sign featuring a flower design with the text "" nechels and proud "" in bold letters."
100984.jpg,"a motivational poster featuring bold text that reads, "" may the mass times acceleration be with you, "" on a black background."
100985.jpg,"a hooded figure holds a glowing globe, with a cityscape and a crowd visible beneath, promoting the cyberwarf."
100986.jpg,"two baseball players in gray uniforms walk on the field, one wearing a glove and the other in a black cap."
100987.jpg,"a historical poster announcing an anniversary celebration at the first of august, celebrating an event from the city hall."
100988.jpg,"two stylish watches are displayed, one with a black dial and the other in gray, showcasing their distinct designs."
100989.jpg,"a book cover titled "" mission flats "" by william landay, featuring a dramatic urban scene with industrial elements and bold text."
100990.jpg,"a close - up of a human foot with pink nail polish, placed near a laptop keyboard."
100991.jpg,"a poster promoting "" stop germs, "" highlighting wash hands with soap and warm water, emphasizing hygiene."
100992.jpg,"a baseball player in a white uniform with the number 12 stands on the pitcher ' s mound, preparing to pitch."
100993.jpg,"a computer monitor displays the "" xine "" logo, showcasing a sleek design and a dark background."
100994.jpg,"the image shows a scoreboard at a baseball game, showing game scores and a score of 20 : 27."
100995.jpg,"a white and purple ambulance van labeled "" marq line "" is parked, featuring a visible emergency number and registration plate."
100996.jpg,"a group of people in vintage clothing poses outside a building, with a "" real rosie "" sign prominently displayed."
100997.jpg,"a collection of various coins, including pennies, dimes, and quarters, arranged on a light background."
100998.jpg,"the image shows an open book with a red cover and a page titled "" introduction to philosophy, "" featuring text in a minimalistic layout."
100999.jpg,"a young woman stands outside john d. kemper hall of engineering, wearing a blue shirt with "" kempper hall "" on it."
101000.jpg,"four bottles of whiskey are displayed : jack daniel ' s, macallan, and king stash, all with distinct labels."
101001.jpg,"a silver coin featuring a building design, labeled "" republik osterreich, "" dated 2010, with text around the edge."
101002.jpg,"the image features several small glass bottles, including a brown bottle labeled "" beard oil "" and a smaller brown bottle labeled "" whitening cream. """
101003.jpg,"two clear glass bottles with a black lid and a white cap, both labeled "" clear. """
101004.jpg,"a man in a red baseball uniform stands on the field, wearing striped socks and a cap."
101005.jpg,"a baseball game scene with players in pinstripes, a pitcher throwing, and a crowd in the stands."
101006.jpg,"a vintage school bus is parked on a gravel road, with a cloudy sky in the background."
101007.jpg,"a boy in a sports uniform runs on a track, while another boy watches closely."
101008.jpg,"a man in a suit holds a book titled "" social embarco, "" seated in a conference room."
101009.jpg,a smiling woman leans near a stack of bud light cans on a wooden table.
101010.jpg,"two white t - shirts with pink text that say "" hudson ' s x - vaneck for shirt "" and "" my deep neck for choice. """
101011.jpg,a football match scene with players in black and yellow jerseys competing for the ball on a grassy field.
101012.jpg,"two white mugs with black text reading "" gunt "" are placed on a table, one marked as a mug."
101013.jpg,"a hand holds a mobile phone displaying a colorful wallpaper with the time and date, set against a plain background."
101014.jpg,"a clear plastic cup with a red heart and the word "" i  milk "" printed on it, set against a dark background."
101015.jpg,"a large billboard promoting a musical event titled "" 20h2, "" featuring performers in traditional attire and promotional text."
101016.jpg,"the image features a metallic book, a blue marble, and a green marble, all related to the "" sunshine mining "" initiative."
101017.jpg,"two bottles of pantene pro v hair care product, featuring a deep burgundy color and a sleek design, promoting personal care."
101018.jpg,"a person ' s hand rests on a plaid bed skirt, holding a mobile phone, with a watch visible on their wrist."
101019.jpg,"a gray military ship with a radar array is navigating in the ocean, alongside a oil platform."
101020.jpg,"a vintage typewriter with a blue body and black keys, featuring a note that reads "" nekobox k1. """
101021.jpg,a glass of beer sits on a table next to a can of soda and a bag of potato chips.
101022.jpg,"a weathered truck with the word "" nevd "" painted on the side, parked beside a building."
101023.jpg,"a man in a yellow sports uniform stands on a grassy field, wearing black shorts and a watch."
101024.jpg,"three cyclists pose together, holding a trophy, wearing sports uniforms and casual clothing, with a woman in a black dress nearby."
101025.jpg,"a finnair airplane is taxiing on a wet runway, with wet runway markings visible in the foreground."
101026.jpg,"album cover for "" song and dance man "" by michael gray, featuring a stylized guitar and vibrant colors."
101027.jpg,"several small boats are docked in calm waters near a harbor, with houses and a red structure in the background."
101028.jpg,"a man in a baseball uniform stands on the pitcher ' s mound, holding a glove, ready for play."
101029.jpg,"a busy amusement park with people walking, a british flag, and a food court in the background."
101030.jpg,"a variety of dishes and dishes are spread out on a table, including bowls of soup, rice, and various dishes."
101031.jpg,"two bottles of wine are displayed on a table : a light green bottle labeled "" hernotte "" and a pink bottle labeled "" pinotic."
101032.jpg,"the image features three corded phones in different designs, showcasing different buttons and designs for communication."
101033.jpg,"a collection of books on a shelf, featuring titles on programming, design, and technology, organized neatly."
101034.jpg,"a person is using a laptop with a monitor displaying code, while a computer keyboard is visible nearby."
101035.jpg,a silver vehicle is parked beside a glider aircraft on a grassy field.
101036.jpg,"a whiteboard sketch illustrating a collaborative workflow, featuring sketches and notes, including ideas related to project management and project management."
101037.jpg,"a collection of comic books featuring colorful covers, including "" spider - man "" and "" spider - man ' s adventures. """
101038.jpg,"a parking meter with two slots, displaying time and payment options, is placed on a grassy area near a grassy area."
101039.jpg,"the image features several books on a table, focusing on the triumph of j. johnson, with a focus on his contributions."
101040.jpg,"the image shows several clear bottles labeled "" diesel diesel, "" likely containing a diesel, but they are not related to the design or production."
101041.jpg,"a computer monitor displays the microsoft windows 2000 professional logo, indicating it ' s a windows professional software setup."
101042.jpg,"the image features a man speaking passionately, with a book titled "" urecica "" and a promotional banner for a spanish language language event."
101043.jpg,"a round wall clock with a white face, black hands, and a bold black hour and minute hand."
101044.jpg,"the image shows a convenience store with various items, including signs for cash only and a variety of products."
101045.jpg,"two green wine bottles are displayed on a table, labeled with domaine roitor from the meursault region."
101046.jpg,"the image features two large red signs on a wall, labeled "" owertty "" and "" born r. i. w. y. "" above"
101047.jpg,"the image shows a compact audio system with a digital display and control buttons, featuring a metal casing."
101048.jpg,"a man in a blue judo uniform demonstrates a training session, holding a blue belt and wearing a black belt."
101049.jpg,close - up of an htc mobile phone displaying the brand logo and colorful background elements.
101050.jpg,"the image shows a scoreboard at a baseball game, with player names and scores listed in the bottom row."
101051.jpg,"a chalkboard sign announces "" south - west beer fest "" on saturday, october 31, with handwritten notes and a light switch nearby."
101052.jpg,"the image shows a digital calculator with a digital display showing "" 00 : 00 "" and a timer showing "" 00. """
101053.jpg,"a woman in a red sports uniform and a mascot in a white shirt, both smiling and posing for the camera."
101054.jpg,"a classic red pickup truck with a classic design, featuring a classic rear and classic wheels, parked among other vehicles."
