image_id,caption
100000.jpg,"the image features a large billboard for "" abacadabra, "" promoting water conservation and wellness."
100001.jpg,"a hand holds a watch, with a knife and knife rest on a snowy beach, alongside a knife and knife holder."
100002.jpg,"a rustic building features a storefront with posters, a bicycle, and colorful posters on the walls."
100003.jpg,"a red asus laptop is displayed on a table, with two other laptops in the background."
100004.jpg,"a decorative picture frame holds a cross - stitch framed artwork titled "" blasphemmy "" with a humorous message."
100005.jpg,"a tall, modern glass skyscraper with a distinctive angular design, featuring a prominent sign at the base."
100006.jpg,"a convenience store named "" barbasa "" features colorful products and displays various products outside its entrance."
100007.jpg,"several small aircraft are parked on a runway, with a clear sky and clouds in the background."
100008.jpg,"a row of colorful bottles with labels, showcasing different types of beer, displayed on a shelf."
100009.jpg,"the image shows a colorful book titled "" muse "" by eric stimmer, featuring vibrant cover art with playful text."
100010.jpg,"a vintage airplane with a blue fuselage and propeller, parked on a runway at sunset."
100011.jpg,"a black wine bottle labeled "" pinot grigio cebare "" with a circular design and the name "" ilustre "" prominently displayed."
100012.jpg,"the image features an advertisement for an iphone, highlighting its features and application icons on its screen."
100013.jpg,"a deck of cards with red and white symbols, accompanied by a red poker chip and a red dice on a green background."
100014.jpg,"a vintage magazine cover features several books, including "" the book of love "" and "" the hundred year love, "" with decorative text."
100015.jpg,"a cluttered bookshelf displays various books, including titles on history, literature, and a large chocolate pot."
100016.jpg,"the image features multiple stop signs, displaying the word "" stop "" prominently in red, with additional signs indicating no vehicles or stop."
100017.jpg,"a colorful swatch watch features a truck graphic, text, and the words "" loveswitch, "" "" slutch, "" and "" fire"
100018.jpg,"a mobile phone displaying a time and date, with a circular clock showing 12 : 25 and a blue sky background."
100019.jpg,"a samsung laptop is displayed, featuring a colorful screen with various bubbles and a blue background."
100020.jpg,"a laptop screen displays a blue message stating "" don ' t eat that "" with a contact number displayed."
100021.jpg,"a yellow ford van is parked, featuring a taxi sign and visible vehicle registration plate."
100022.jpg,"a player in a yellow sports uniform swings a baseball bat, while a catcher in maroon gear crouches behind home plate."
100023.jpg,"a display of various wine bottles, including pink and white wines, showcasing different labels and colors."
100024.jpg,"a triangular warning sign indicates a steep incline path, with a steep rock formation in the background."
100025.jpg,"a military aircraft, camouflaged with a lion logo, is taxiing on a runway surrounded by green grass and trees."
100026.jpg,"a close - up of a laptop keyboard shows the "" crack "" logo and arrows pointing upward."
100027.jpg,"a wooden mobile phone case with a circular cutout, featuring a wooden design and buttons on the side."
100028.jpg,"a man stands with crossed arms, looking thoughtfully towards the roman colossus, with a large banner in the background."
100029.jpg,"a television displays a football match, while a player dribbles a ball on the television stand."
100030.jpg,"a man with short hair is peeking through a window, surrounded by promotional materials on a table."
100031.jpg,"the image shows a television screen displaying a scene from a film titled "" dr. howard, "" with a person in a white shirt holding a bag."
100032.jpg,"a smiling woman with curly hair holds a colorful cartoon character, showcasing a playful pose."
100033.jpg,"the image shows a medical device with a digital display, connected to a medical device, likely a medical device or monitor."
100034.jpg,"a yellow taxi with a police light on top, parked on a road surrounded by trees."
100035.jpg,"a red stop sign is prominently displayed, with wind turbines in the background against a clear blue sky."
100036.jpg,"a brown box labeled "" love shock "" with a cartoonish character and a message about happiness inside."
100037.jpg,"a person stands in front of a large screen displaying "" code for a - hot seou, "" with a bookcase in the background."
100038.jpg,"a busy city street with various vehicles, including taxis, cars, and tall skyscrapers in the background."
100039.jpg,"the image features a page from a book titled "" monuments of the nations "" by mason garre, published in london in 1678."
100040.jpg,"a sleek, rectangular perfume bottle with a wooden cap, featuring a light golden liquid and a sleek design."
100041.jpg,"a black crock - pot slow cooker sits on a countertop, surrounded by kitchen appliances and utensils."
100042.jpg,"two energy drink cans are displayed : one is blue edition and one is burn, both featuring a fiery design."
100043.jpg,"two beakers are shown : one containing a green liquid and the other orange liquid, both labeled with measurement markings."
100044.jpg,"a large passenger ship named "" viking line "" is docked in the harbor, showcasing its distinctive red and white design."
100045.jpg,"the image shows various bottles of apple cider, labeled as "" apple cider, "" showcasing a rich, fruity drink."
100046.jpg,"two boys in baseball uniforms are on a dirt field, one wearing a helmet and the other in a jersey."
100047.jpg,"a computer monitor displays a virtual environment with a grid pattern and various icons, including a "" y "" icon."
100048.jpg,"a person holds a tablet, presenting a presentation on a large screen, with a colorful background and a whiteboard."
100049.jpg,"a black book cover features the text "" i ' m no rocket surgeon "" in gold lettering, emphasizing a motivational message."
100050.jpg,"a sleek, elegant perfume bottle labeled "" shalimar, "" featuring a golden liquid and a blue cap, set against a light background."
100051.jpg,"a black mug with mathematical equations and equations written on it, featuring a simple design and a handle."
100052.jpg,"the image shows a digital scoreboard displaying the time as 0 : 58, with a light - up score of 5. 6."
100053.jpg,"poster detailing the relationship between mahler ' s method and his influence, with data points and diagrams related to the model."
100054.jpg,"a young man in a red baseball uniform stands on the field, wearing a cap and holding a glove."
100055.jpg,"a brick building features a large "" sam ' s "" sign, showcasing a restaurant name prominently displayed."
100056.jpg,"three books are stacked, featuring titles on law, rights, and cyberlaw, highlighting legal themes and themes of law and cyber - law."
100057.jpg,"the image features three people, including a woman and a boy, in a newspaper article titled "" today. """
100058.jpg,"the image shows various usb flash drive containers with cartoonish characters, organized on a shelf."
100059.jpg,"a white hockey jersey featuring the toronto maples logo and the number 9, with blue accents on the sleeves."
100060.jpg,"a bottle of life - like drink sits on a table, illuminated by soft light from a nearby lamp."
100061.jpg,"a decorative box with blue flowers and a dove - like bird, labeled "" happy valentine ' s day. """
100062.jpg,"a row of vintage books titled "" journal of a miniature collector, "" featuring various colors and titles, neatly arranged on a shelf."
100063.jpg,"a group of six people stands on a stage, wearing colorful clothing and holding boxes, with promotional materials nearby."
100064.jpg,"a red waste container with a humorous label, labeled "" operation blinit "" and promoting a waste reduction initiative."
100065.jpg,"a narrow aisle in a library features tall bookcases filled with colorful books, creating a cozy reading area."
100066.jpg,"the image shows a fast food counter with a sign reading "" salads, buns, and sushi. "" it features a pizza section and a"
100067.jpg,"an open book displays text from a historical narrative, featuring a passage about a police officer and a woman ' s experience."
100068.jpg,"a man in a white hat sits in a horse - drawn carriage, with two dogs inside."
100069.jpg,"a model train is displayed on a track, surrounded by various model vehicles and lights."
100070.jpg,"a young boy in a red hockey uniform skates on an ice rink, wearing skates and skates."
100071.jpg,"a colorful costumed figure in a dress holds a sign reading "" kermie de vivre kross as "" at a party."
100072.jpg,"a whiteboard diagram illustrating a project management process, featuring tasks, dates, and connections, labeled with various dates and dates."
100073.jpg,"a football player in a white jersey dribbles the ball on the field, while another player in blue runs nearby."
100074.jpg,"two male wrestlers compete on a mat, one in a red and blue uniform, the other in blue."
100075.jpg,"a cluttered desk with a laptop, a green chair, a lamp, and various stationery items, including pens, markers, and a flag."
100076.jpg,"a tin can labeled "" heinz smoked bear "" sits on a wooden cutting board, showcasing its detailed description and branding."
100077.jpg,"a green highway sign indicates "" heart of the desert "" with an arrow pointing left, set against a vast landscape."
100078.jpg,"the image features a book titled "" gull utanpa "" by patrick lundberg, showcasing a silhouetted figure against a backdrop of flowers."
100079.jpg,"a bottle of ren - du - pape sauvignon blanc 2012, featuring a blue cap and a white label with a sunflower design."
100080.jpg,"a man in a sports uniform signs a paper at a table, surrounded by fans and sports jerseys."
100081.jpg,"the image shows the cockpit of an aircraft, featuring a blue body and a visible registration number, with additional information on the wing."
100082.jpg,"a brass can labeled "" fridas "" hangs on a wooden shelf, filled with various bottles of drink."
100083.jpg,"the image features various books on car and automobile design, including titles on design and automobile history."
100084.jpg,"the image features a plaque commemorating the life and work of julia ward howe, a battle hymn of the american revolution."
100085.jpg,"a silver mobile phone with a flip design, featuring a keypad and a small screen, rests on a wooden surface."
100086.jpg,"an open book displays blank pages with text titled "" inhalec content "" and "" contentc design, "" featuring names and topics."
100087.jpg,"a rider in a white helmet and racing gear rides a green dirt bike, kicking through a muddy course."
100088.jpg,"a person holds a comic book titled "" warrior of dynamic comics, "" surrounded by stacks of comic books."
100089.jpg,"a weathered stop sign displays the word "" stop "" prominently, with the message "" give thanks "" below."
100090.jpg,"a sleek lg mobile phone with a touchscreen display and minimal buttons, featuring a black design."
100091.jpg,"billboard promoting wild foods, featuring a humorous message about love and comfort, emphasizing its importance for health and wellness."
100092.jpg,"a large crane is lifting a container labeled "" warner "" from a crane platform, against a clear blue sky."
100093.jpg,"two glasses of beer are held side by side, showcasing golden liquid and frothy foam, with a menu in the background."
100094.jpg,"two dark glass bottles are displayed, one with a decorative design and the other with a decorative seal."
100095.jpg,"a white mug features a cartoon character wearing a hat and glasses, with a colorful background and the text "" let ' s put the fun back in dysfunction"
100096.jpg,"close - up of a laptop keyboard, featuring black keys with white letters and a prominent key "" k "" at the bottom."
100097.jpg,"digital clock displaying the time as oct 21, 2015, and the date as oct 21, 2015, with bright green numbers."
100098.jpg,"a colorful display of snack boxes and snacks, including snacks like chips and pretzels, in a convenience store."
100099.jpg,"a man smiles, with two children, both wearing green shirts, outdoors in a sunny setting."
100100.jpg,"an ana airplane is taxiing on the runway, with a terminal and airport buildings in the background."
100101.jpg,"a colorful poster featuring a woman ' s face with a hat, promoting the "" estura "" complexly different art forms."
100102.jpg,"a red book titled "" mein kampj "" by guna abeeghuu, published by abell mitre, with a minimalist design"
100103.jpg,"a graffiti on a wall features a black silhouette of a figure with a guitar, accompanied by a text that reads, "" having freedom is not the same"
100104.jpg,"a man is eating noodles from a bowl, with a bottle of beer nearby and condiments nearby."
100105.jpg,a samsung smartwatch displays the time as 14 : 10 and a samsung smartphone showing the time.
100106.jpg,"a bottle of rekorderen beer stands beside a glass filled with a dark beverage, showcasing a refreshing drink."
100107.jpg,"a 1 penny coin from the year 1998, featuring a crown and inscriptions around the edge."
100108.jpg,"a wet street with people walking, trees lining the sides, and a stone wall in the background."
100109.jpg,"a man in a baseball uniform pitches a ball, wearing a glove and dark footwear on the field."
100110.jpg,"close - up of a laptop keyboard, highlighting the keys "" y, "" "" y, "" and "" y, "" with a dark background."
100111.jpg,"a skateboarder performs a trick on a rail, surrounded by greenery and spectators in a sunny outdoor setting."
100112.jpg,"three green waste containers are lined up, labeled for recycling, with snow falling on them."
100113.jpg,"a samsung mobile phone displaying the time and various app icons on its screen, resting on a marble surface."
100114.jpg,"a tall cardboard structure made of boxes, labeled with various names, stands outside a building."
100115.jpg,"a person in a pirate costume holds a sign, surrounded by various items on a table."
100116.jpg,"a busy street scene with people walking, cars parked, and colorful storefronts displaying various stores."
100117.jpg,"a red book titled "" a physical introduction to suspension dynamics "" features a detailed illustration of a complex structure."
100118.jpg,"a glass of beer with a golden color, featuring a logo for tennent ' s and the name "" s scottland. """
100119.jpg,"a black prada watch box is displayed, featuring a sleek prada watch inside, showcasing luxury fashion accessories."
100120.jpg,"two men stand in front of a small aircraft, labeled "" ger cargo, "" on a runway under a cloudy sky."
100121.jpg,"a red robot coupe blender with a stainless steel bowl, designed for food preparation and blending."
100122.jpg,"the image shows a digital display reading "" experience "" with timestamps for days, hours, minutes, and seconds."
100123.jpg,"three individuals pose together, wearing hockey jerseys, in an office setting with a plant in the background."
100124.jpg,"a cartoonish illustration of a ship with a skull and a pirate ship, labeled "" american spewers. "" the text reads "" a risser"
100125.jpg,"a baseball team celebrates a victory on the field, wearing white uniforms with black accents, under dark skies."
100126.jpg,"the image features a bus sign for "" familymart "" and a sign for "" 24 open "" with a silhouette of a person."
100127.jpg,"the image features two book covers : "" steampunk ii "" by ann l. vandermeer and "" steampunk ii "" by ann"
100128.jpg,"four men stand in front of a racing car, holding a trophy, celebrating a victory in a race event."
100129.jpg,the image shows a laptop with a visible keyboard and colorful display showing data points.
100130.jpg,"a white box labeled "" potassium iodide 5 mg "" with red accents, placed on a dark surface."
100131.jpg,"a colorful convenience store displays various products, including chocolates, candies, and candies, with a welcoming sign above."
100132.jpg,"the image features a book cover titled "" blue mars "" by kim stanley robinson, showcasing a cosmic scene with planets and spaceship."
100133.jpg,"a bag of doritos x - 13d chips, labeled as "" doritos x - 13d, "" contains 10 packets of chips."
100134.jpg,"a vintage airplane, marked "" mr. officer air ambulance, "" is parked on a runway under a blue sky with fluffy clouds."
100135.jpg,"a man and a woman are engaged in a handshake on a boat, with calm water in the background."
100136.jpg,"poster for the play "" the theatre "" featuring performances by various performers, including a performer and a performer. date and time are august 23, 2013."
100137.jpg,"a man in a basketball uniform stands on the court, focused and ready for action, with a cheering crowd in the background."
100138.jpg,"a wire basket holds various books, including titles on management and personal finance, organized neatly."
100139.jpg,"a man with long hair sits on a football field, wearing a sports uniform, looking focused and focused."
100140.jpg,"a large billboard displays the text "" el shafair room restaurant "" in bold red letters against a clear blue sky."
100141.jpg,"the image features a bag of cheero ' s snacks, including a colorful snack design and a cartoon character holding a drink."
100142.jpg,a baseball pitcher in a white uniform with red accents throws a pitch on the field.
100143.jpg,"a double - decker bus in brighton, marked with route number 39 to brighton, parked on a city street."
100144.jpg,"a vintage blue typewriter sits on a cobblestone surface, showcasing its classic design and keyboard layout."
100145.jpg,"a row of parked cars is lined up against a colorful building, with a tree in the foreground."
100146.jpg,"a vintage television displays a retro video game scene, featuring a cyclist on a path with colorful graphics."
100147.jpg,"a red octagonal stop sign is prominently displayed, surrounded by trees and greenery in the background."
100148.jpg,"a spacious airport terminal with check - in counters, travelers, and a check - in counter displaying flight information."
100149.jpg,"a packaged banana is displayed in a plastic bag, labeled with japanese text, indicating it ' s a snack."
100150.jpg,"a street scene featuring several cars parked along the curb, with shops and a tram line overhead."
100151.jpg,"an open book displays text in a black - and - white photograph, with a partially visible page of text on the left."
100152.jpg,"a blue billboard welcomes visitors to selly oak station car park, promoting the new parking area at the entrance."
100153.jpg,"a female football player in an orange sports uniform walks on the field, focused and ready for action."
100154.jpg,"the image shows an open book with text titled "" and of vol i "" and "" erata, "" published in 1678."
100155.jpg,"directional traffic signs indicate directions to whitechart and wovenham, with a bus stop and bus stop at the bottom."
100156.jpg,"the image features stacked boxes, including a green box labeled "" mini mint mini mints "" and a red box labeled "" abc. """
100157.jpg,"a bottle of special reserve wine from the mouille brown, featuring a vintage label with details about its origin."
100158.jpg,"a dark bottle with a pink label featuring chinese characters and a character holding a sticker, placed on a wooden surface."
100159.jpg,"a pitcher in a gray sports uniform throws a baseball on a field, with a pitcher in motion."
100160.jpg,"map of bell trail and lone canyon, featuring trail details, location, and elevation details for the apache maeil trail."
100161.jpg,"two coca - cola zero caps are displayed : one black with red branding and one red with white branding, both featuring the brand logo."
100162.jpg,"the image features a vintage advertisement for the dx100, showcasing electronic keyboards and gaming consoles, highlighting savings and savings."
100163.jpg,"a red sprint car with large wings races on a dirt track, showcasing its powerful design and branding."
100164.jpg,"two dell laptops are displayed side by side, featuring a vibrant screen with the text "" advancing with my incredible x815. """
100165.jpg,"the image features a colorful box for "" exo - xy - xy ninjas, "" a retro video game about space exploration, with a"
100166.jpg,"a laptop displays a warning sign about change happens, with a warning symbolizing the ongoing ongoing of a unprocessed world."
100167.jpg,"a smiling girl holds a book titled "" cupid with hope "" and a pink shirt, sitting in an indoor setting."
100168.jpg,"the image is a magazine cover featuring a stylized face, with text highlighting the issue "" next generation, "" highlighting gaming on the edge."
100169.jpg,"a person holds a book titled "" posterity "" by playbill, featuring a portrait of abraham lincoln."
100170.jpg,"a poster advertising a dark and naughty scotch whisky, featuring a unicorn - like figure and a bottle of jack daniel ' s scotch whisky."
100171.jpg,"a tall, elegant bottle of white wine labeled "" nova, "" featuring a sleek design and reflective surface."
100172.jpg,"a framed document titled "" a historical narrative, "" detailing events and events in a historical setting."
100173.jpg,"a collection of various beer bottles, featuring different labels and colors, arranged on a carpeted surface."
100174.jpg,"a laptop is open on a desk, displaying a webpage, with a mobile phone nearby."
100175.jpg,"a close - up of a glass of kaiser beer, showcasing its label and frothy surface against a cloudy background."
100176.jpg,a silver tissot watch with a brown leather case is displayed alongside a silver watch bracelet.
100177.jpg,"a woman sits at a wooden table, writing in a notebook, with a lamp and a sign in the background."
100178.jpg,"a small kitchen featuring a gas stove, a sink, and a refrigerator with a blue tiled wall."
100179.jpg,an open notebook displays handwritten notes and a drawing of a bear on lined paper.
100180.jpg,"a nokia mobile phone displays a sim card interface, indicating it ' s connected to a device with a physical connection."
100181.jpg,"a football match scene with players in red and blue uniforms, a referee, and a referee discussing the play."
100182.jpg,"a person holds a mobile phone, capturing a scene with a drink and a blurred figure in the background."
100183.jpg,"a 3d printer is displayed in a protective case, with a price sign indicating $ 49. 95 for the printer."
100184.jpg,"the image shows a small, electronic device with a control panel and buttons, likely a microchip or microchip unit."
100185.jpg,"a close - up of a rolex watch featuring a black dial, date display, and a stainless steel bracelet."
100186.jpg,"the image features three computer keyboards stacked on top of boxes, showcasing their sleek designs and features."
100187.jpg,"the scoreboard displays game information for the brooklyn nets at barclay center, with a score of 25 to 16."
100188.jpg,"a vintage orange corded telephone with a rotary dial, resting on a surface with various corded wires."
100189.jpg,"the image shows the grand facade of the opera de paris, featuring classical columns and sculptures."
100190.jpg,"two bottles of wine labeled "" edenberry wine "" from cain view winery, showcasing their vintage and american origin."
100191.jpg,"a red hatchback car is parked beside a snowy pond, surrounded by greenery and trees."
100192.jpg,"the image features a decorative emblem with the text "" department of the army, "" surrounded by symbols and inscriptions."
100193.jpg,"a black hp printer is placed inside a cardboard box, revealing a sheet of paper inside."
100194.jpg,"a mobile phone rests on a surface, displaying a colorful app interface with various app icons."
100195.jpg,"a group of six young adults, including a man in a red shirt, smiling and holding books."
100196.jpg,"a large blimp with "" directy "" branding floats in a clear sky, showcasing its sleek design and colorful branding."
100197.jpg,"the image shows the cover of a book titled "" the ranger programme, "" featuring a red text design and a canadian flag."
100198.jpg,"a man holds a glass of water, wearing a black shirt and cap, in front of a store display."
100199.jpg,"a man walks past a bank booth, with a sign reading "" think uk, "" while a person in a blue shirt is blurred nearby."
100200.jpg,"a green bottle of jameson ' s irish whiskey, labeled "" the oldest vintage reserve, "" with a distinctive label design."
100201.jpg,"a group of baseball players in blue uniforms celebrate a play, with one player in the outfield high five."
100202.jpg,"the image features a poster advertising turbosonic, a portable audio system, with a colorful design and promotional text."
100203.jpg,"a smartwatch displays a map on its screen, worn on a wrist, with a blurred background."
100204.jpg,"the image features multiple vintage newspaper posters displayed on a wall, showcasing various headlines and images related to war and wartime."
100205.jpg,"two caution signs are displayed : one warns of a mind - blowing trick, the other warns of a caution trap."
100206.jpg,"two people are seated in a dark setting, discussing on multiple computer monitors displaying video content."
100207.jpg,"a framed illustration depicts a barn with a snowy landscape, framed and ready for display."
100208.jpg,"a blue boat with four passengers navigates the water, splashing water, showcasing a watercraft design."
100209.jpg,"a person wearing a red shirt displays a logo for the river city rollers, featuring a cartoon character."
100210.jpg,"poster for "" across the universe "" at 7th street theatre, featuring a red heart and splatter design. date and time are april 24, 2015"
100211.jpg,"a woman in a black shirt and jeans hugs a girl in a white shirt, both standing in a kitchen setting."
