image_id,caption
101692.jpg,"a red double - decker bus labeled "" lewisham bus 21 "" is driving on a city street, displaying route number 21."
101693.jpg,"a man in a blue sports uniform pitches a baseball on a grassy field, with another player in the background."
101694.jpg,"a close - up of a beer bottle label, featuring "" b ' s scent, "" with a green background and a focus on the drink."
101695.jpg,"a parking meter displays a black poster with text and a stylized figure, indicating a new york city theme."
101696.jpg,"two parking meters are mounted on a pole, displaying green and black signs, with handwritten messages."
101697.jpg,"a bottle of cooper ' s beer stands next to a glass filled with golden beer, set on a wooden table."
101698.jpg,"a red and black book cover titled "" shakespeare ' s henry iv, "" featuring a description and author details."
101699.jpg,"the image displays a table displaying the various types of women ' s hairstyles, with names and dates in green and pink sections."
101700.jpg,"a black waste container labeled "" national museum of the marine corps "" sits on grass, with a triangular top."
101701.jpg,"a woman sits at a table with various glasses and bottles of wine, including a bottle of cabernet sauvignon."
101702.jpg,a baseball player in a yankees uniform waves to the crowd at a stadium during a game.
101703.jpg,"a whiteboard displays notes on culture, jobs, and hate, including personal reflections and perceptions of hate - related individuals."
101704.jpg,"the image features a page from a magazine discussing the future of the newspaper, highlighting its layout and design."
101705.jpg,"a man in a southbench baseball uniform walks on a grassy field, wearing a black cap and a black jersey."
101706.jpg,"a tall tin can labeled "" la latte "" with a metallic finish, featuring the number "" 60 "" and a signature."
101707.jpg,"the image displays a computer monitor showing a system interface with a file management window open, showing system information and a file management window."
101708.jpg,"a steampunk lego poster featuring a ship, dragon, and a dragon, with a decorative background and text."
101709.jpg,"a blue sports jersey featuring the name "" owen "" and the number "" 16 "" with a prominent number "" owen "" and the number "" owen "" prominently"
101710.jpg,"the image features multiple wall clocks with different times, mounted on a white wall."
101711.jpg,"two bottles of jagermeister are displayed, one green and one dark, showcasing a rich, dark liquid inside."
101712.jpg,"a modern office space featuring two desks, computers, and a plant, with a logo displayed on the wall."
101713.jpg,a bottle of rahr sons stormcloud india pale ale stands next to a glass filled with the beer.
101714.jpg,"a black computer keyboard with a blue tab, placed on a wooden surface, alongside a protective case."
101715.jpg,"a football match scene with players in red and white uniforms, a goalkeeper, and a crowd in the stands."
101716.jpg,"a modern building featuring a triangular roof, with the word "" postnord "" prominently displayed."
101717.jpg,"three books are displayed : "" the hobbit, "" "" der geheimen der walze, "" and "" der hobbit, """
101718.jpg,"a black mobile phone with a flip design, featuring a touchscreen and a minimalistic logo on the back."
101719.jpg,"a wooden wall displays a colorful sign reading "" the blybert time to read, "" alongside a model ship and a street sign."
101720.jpg,"two green bottles of bud light beer labeled "" tup "" and "" 7up, "" placed on a shelf."
101721.jpg,"the image features a detailed, ornate coin depicting the coat of arms of the united states, with a central figure and a cross at the bottom."
101722.jpg,"a man stands in front of a large, industrial cityscape, with smoke rising from stacks and taters. the poster features arabic text and an"
101723.jpg,"a red sports jersey with "" de niss "" and "" basketball "" printed on it lies on a couch, surrounded by sports equipment."
101724.jpg,"a collection of green bottles of beer is splashing through ice, showcasing their labels and branding."
101725.jpg,"a military aircraft is displayed with two people observing it, showcasing its military markings and markings."
101726.jpg,"a man wearing a white shirt with "" policia electoral "" printed on the back, standing behind a fence."
101727.jpg,"a plate features grilled chicken, french fries, salad, and a can of coca - cola, with drinks in the background."
101728.jpg,"a worn nationals jersey hangs in a museum, showcasing the team ' s name and number prominently displayed."
101729.jpg,"book cover of "" the vanishing "" by donald hamilton, featuring a man holding a gun against a colorful, snowy landscape."
101730.jpg,"the image shows various bottles of syrups, a packet of medication, and a bag of medication."
101731.jpg,"billboard promoting the "" celebrating gama "" with the slogan "" international hot powder dry, "" promoting a premium product."
101732.jpg,"a sleek, blue and white aircraft with the name "" merica "" displayed indoors, showcasing its sleek design and design details."
101733.jpg,"several vintage glass bottles are displayed on a glass shelf, each with a unique shape and texture."
101734.jpg,"a bottle of "" batel "" 5 - year - old malt whisky, featuring an orange label with decorative elements and a decorative logo."
101735.jpg,"a framed collage of images related to the wie technology, featuring images and text related to internet connectivity."
101736.jpg,"a clear bottle of water labeled "" nata zourardis, "" placed on a floor with a person ' s foot visible in the background."
101737.jpg,"a lego city helicopter set with two individuals, showcasing a white and blue design."
101738.jpg,"the image features a vintage advertisement for a beer pump, promoting the drink from toronto, highlighting its tonite production."
101739.jpg,"a decorative box featuring a dark design with gold text and a circular opening, labeled "" hard rock slim. """
101740.jpg,"two mobile phones are displayed side by side, showing their screens with a lock and a time of 3 : 11 : 51."
101741.jpg,"a circular wall clock with a brass frame, featuring compasses and dials, mounted on a textured wall."
101742.jpg,"two computer keyboards are placed in a cardboard box, surrounded by smaller keyboards and cables."
101743.jpg,"a baseball player in a washington nationals uniform holds a glove, preparing to throw the ball during a game."
101744.jpg,"a woman walks past a green storefront labeled "" e - shopping tree, "" featuring a vibrant sign and outdoor seating."
101745.jpg,"three bottles of corona mega beer are displayed on a refrigerator. one is dark green, the other light yellow, and the third is light red."
101746.jpg,"the image features two cans of beverage : a green tin can labeled "" organic green tea "" and a yellow can labeled "" phuket. """
101747.jpg,"a blue and white mug with a handle, featuring the text "" white castle "" and a message about people who have nothing to love."
101748.jpg,"the image shows a digital race timer displaying the time as 6 : 12 : 20, with a red and blue design."
101749.jpg,"the image shows a sony playstation 3 console and two game controllers, with a sony playstation 3 logo displayed in the background."
101750.jpg,"a man in military clothing uses a drill to repair a wooden shop sign, showcasing a diy project."
101751.jpg,"four men in sports uniforms stand on a basketball court, showcasing team spirit and camaraderie."
101752.jpg,"a person writes on a whiteboard, drawing a geometric shape with red marker, labeled "" california side of the page. """
101753.jpg,"a white and red bus labeled "" city bus "" is driving on a street, with a clear sign above it."
101754.jpg,a hand holds a mobile phone displaying a weather app with a temperature of 15c and a weather forecast for mexico.
101755.jpg,"several bottles of cordial are displayed, featuring a rich brown liquid, with a clear glass beside them."
101756.jpg,"the image shows a framed model of a electronic sta - 128, featuring various buttons and a control panel."
101757.jpg,"the image features a vintage keyboard set with various keys, displayed on a checkered fabric background."
101758.jpg,"a television displays a news broadcast about an oil spot blast, with a dramatic smoke cloud in the background."
101759.jpg,"four men stand together, wearing matching polo shirts and jeans, with one wearing a cowboy hat and jeans."
101760.jpg,"two fans in sports uniforms cheer, while one holds a red flag, surrounded by a cheering crowd."
101761.jpg,"a group of people stands around a whiteboard, discussing notes and ideas related to a project or project."
101762.jpg,"a volleyball match in progress, featuring players in action on the court, with a large crowd in the background."
101763.jpg,a young man in a white hoodie and a woman in a gray jacket exchange hands outdoors near a lake.
101764.jpg,"a television displays a video game titled "" pokemon jr pika ' s ultimate masters "" surrounded by various video game boxes."
101765.jpg,"a television displays a basketball player, with the text "" has gracias? "" below, below, below, below."
101766.jpg,"a poster with a humorous message stating, "" i like cooking my family and my pets. "" it promotes commas. don ' t be a psycho"
101767.jpg,"a military aircraft is parked on a deck, with two personnel observing nearby, under a cloudy sky."
101768.jpg,"the image shows a box of cheerios cereal, labeled "" whole grain, "" highlighting its creamy cheerios flavor."
101769.jpg,"a spacious room with wooden walls, a long table, chairs, and whiteboards displaying information."
101770.jpg,"a bottle of hob hausch, a scottish single malt scotch whisky, is displayed on a wooden surface."
101771.jpg,"a white karbonn k405 mobile phone with a numeric keypad and a blank screen, featuring a simple design."
101772.jpg,"a small black car is parked in an indoor space, with a larger aircraft visible in the background."
101773.jpg,"a hand holds a fishing reel and a watch, with a scenic background of water and a boat ' s wheel."
101774.jpg,"four female athletes compete in a race, wearing sports uniforms and running shoes, with a speaker visible in the background."
101775.jpg,"the image features a poster titled "" the devil ' s escape, "" showcasing a scenic scene with a figure swimming in water."
101776.jpg,"a smiling woman with short hair wears a black shirt, sitting against a wooden background."
101777.jpg,"a truck drives on a highway, with a green exit sign for "" exit 16 "" and a directional arrow for "" kanechi. """
101778.jpg,"the image features a vintage book page with latin text, detailing its historical significance and significance in the church."
101779.jpg,"a hp pavilion 15 laptop is open, displaying the logo on the screen, featuring a silver keyboard and a sleek design."
101780.jpg,"a silver coin featuring a portrait of a man, inscribed with "" chitrapaan, "" dated 2009."
101781.jpg,"a beaker contains dark liquid, with a straw inserted, indicating a mixture or mixture in a beaker."
101782.jpg,"a blue and red pepsi can stands on a table, accompanied by a note asking if you ' re not in the kitchen."
101783.jpg,"a person holds a mobile phone and a passport, while another holds a passport, both with their hands visible."
101784.jpg,"a vintage alarm clock with a minimalist design, displaying black numbers and hands, placed on a surface."
101785.jpg,"colorful poster for "" mr. reicht ' s "" event in hamburg, featuring silhouetted figures and text promoting a cultural event."
101786.jpg,"the image shows the title page of a book titled "" commentaries on the laws of england, "" published by sir william blackmore, dated 1826."
101787.jpg,"a stack of books is displayed on a table, surrounded by boxes, showcasing various titles and colorful covers."
101788.jpg,"the image features a book cover titled "" 20 years of rolling stone, "" highlighting a long, strange trip it ' s been."
101789.jpg,a stainless steel bosch microwave oven with a glass door and digital controls on the front.
101790.jpg,"a young boy in a black sports uniform crouches on a baseball field, holding a baseball glove."
101791.jpg,"a television displays a video of a man with gray hair, looking serious and serious."
101792.jpg,"three boats are anchored in calm waters, surrounded by lush forest, with distant structures in the background."
101793.jpg,"a silver chronograph watch with a white dial, featuring multiple chronograph functions and a brown leather strap."
101794.jpg,"two yellow taxis are parked on a city street, emitting steam, with a bustling street scene in the background."
101795.jpg,"a boy in a black jersey dribbles a soccer ball while two others watch, showcasing teamwork and athleticism."
101796.jpg,"a man in a blue mets baseball uniform stands on the field, holding a baseball glove and looking focused."
101797.jpg,"two mobile phones are displayed side by side, one black and one dark, both featuring a textured back design."
101798.jpg,"a model of a water well is displayed, featuring workers and a police car in the background."
101799.jpg,"a brown bible titled "" matthew 5. 4 "" rests in a wooden box, surrounded by various religious books."
101800.jpg,"a smiling man holds a bottle of benja roa, a dark beverage, wearing glasses and a sports uniform."
101801.jpg,"the image shows a page from a book titled "" plaster patching, "" detailing techniques and instructions for painting and diy projects."
101802.jpg,"the image features a promotional poster for the "" call of duty eternal warfare, "" highlighting gameplay and gameplay details."
101803.jpg,"a collection of comic books featuring colorful covers, featuring superheroes and superheroes, arranged neatly on a dark surface."
101804.jpg,"a baseball player stands on the field, preparing to pitch, with a pitcher in motion and a scoreboard in the background."
101805.jpg,"a large passenger boat named "" ohio red line "" is docked near a lighthouse, with passengers visible on board."
101806.jpg,"a vintage movie poster for "" swing shift maisie, "" featuring iconic characters in dramatic poses, with bold colors and bold typography."
101807.jpg,"the image features colorful signage and a vibrant advertisement, showcasing a variety of products."
101808.jpg,"a modern library interior featuring colorful furniture, shelves, and a prominent sign for taiwan corner."
101809.jpg,"a colorful billiard ' s ball arranged in a triangle, showcasing various colors and markings on a blue background."
101810.jpg,"the image shows a california vehicle registration plate with the letters "" adsense "" and a bmw logo."
101811.jpg,"the image shows a virginia vehicle registration plate with the text "" sonuva "" and colorful illustrations."
101812.jpg,"a brown beer bottle labeled "" tikkelle "" features a cowboy - themed label with the text "" texas ranger barrel aged. """
101813.jpg,"a white boat with a flag is anchored in calm waters, surrounded by lush greenery and a small island."
101814.jpg,"a person stands beside a projector displaying information about a metal casting process, including images and descriptions of the project."
101815.jpg,"modern glass elevator with a stainless steel frame, featuring a handrail and a glass door leading to an elevator."
101816.jpg,"an lg television displays a blank screen, with a control panel visible beneath the screen."
101817.jpg,"a poster on a waste container reads "" citizen dick, "" promoting a band concert at the baltimore waterfront."
101818.jpg,"a calculator sits on a document titled "" sit40, "" alongside a printed document with instructions for a mathematical calculation."
101819.jpg,"the image shows a page from a book, featuring a quote by oscar wilde about beauty and elegance."
101820.jpg,"a large billboard displays the text "" good to be back home, "" emphasizing the message of a positive connection."
101821.jpg,"the image features a magazine cover titled "" brain damage, "" highlighting music artists and their impact on brain damage."
101822.jpg,"a wooden table displays various bottles, including a jug and a bowl, alongside a small orange bowl."
101823.jpg,"a silver watch with a blue and white dial, featuring chronograph functions and a date display, placed on a printed background."
101824.jpg,"close - up of an old typewriter keyboard, featuring keys with letters and numbers, including "" e, "" "" y, "" and "" c."
101825.jpg,"a decorated christmas tree stands beside two children unwrapped presents, with a bright, warm backdrop."
101826.jpg,"a vibrant pink "" rys "" logo is prominently displayed, with bold, stylized letters and splatters in the background."
101827.jpg,"an antique hermes typewriter with a classic keyboard layout, showcasing classic office supplies from the past."
101828.jpg,"a stylish watch with a black face and silver bracelet, worn on a wrist, showcasing elegance and style."
101829.jpg,"the image features a collage of religious images, including a book titled "" the world ' s treasures "" and a green parrot."
101830.jpg,"two players compete in a floorball match, one in black and the other in red, with sticks and a ball."
101831.jpg,"poster for "" love techno, "" featuring a stylized lion design and event details for "" get the way "" at the university of sydney."
101832.jpg,"a silver coin featuring a maple leaf design, inscribed with "" canada "" and "" 1 / 2 ounce, "" dated 2009."
101833.jpg,"a young woman in a pink sports uniform stands near a volleyball net, focused and ready for play."
101834.jpg,"a poster on a wall discusses the significance of the gamification of various products, including electroelectrics and laminates."
101835.jpg,"the image shows a vehicle registration plate with the text "" i ' d rather be utah "" and "" 509 xum "" at the bottom."
101836.jpg,"the image features a whiteboard with notes on public relations, including topics like "" finding job creation "" and "" future job creation. """
101837.jpg,"a man in a baseball uniform prepares to pitch, wearing a red cap and holding a baseball glove."
101838.jpg,"two stylish watches : one with a black dial and one silver - tone with a black face, both featuring clear hour markers."
101839.jpg,"a group of athletes in sports uniforms poses with a mascot, showcasing team spirit and camaraderie."
101840.jpg,"the image shows a scoreboard at virginia, displaying the game time as 12 : 34 and the score as 22."
101841.jpg,"a black car is parked beside tall grass, with a visible vehicle registration plate visible."
101842.jpg,"a baseball game scene with players in uniforms, a pitcher, and a batter preparing to throw. spectators are visible in the background."
101843.jpg,"the image features a collection of vintage science fiction books, showcasing colorful covers and various titles, showcasing notable authors and authors."
101844.jpg,"a player in a sports uniform swings a baseball bat, while a catcher and teammates watch from the dugout."
101845.jpg,"an orange bookmark displays "" scott ' s room service "" on a white background, alongside a plain white wall."
101846.jpg,"a group of players in red and black jerseys compete in a floorball match, with a net and ball in play."
101847.jpg,"the image features a vintage advertisement for the hummingbird giftware, showcasing a black pitcher, a pitcher, a picture frame, and decorative elements."
101848.jpg,"a woman with blonde hair smiles while holding a certificate titled "" proof of module completion "" in a library setting."
101849.jpg,"the image features a book cover titled "" sea siege "" by andre norton, depicting a man sitting in a desert landscape with a torch."
101850.jpg,"a close - up of a wine bottle label, labeled "" joles de mor, "" indicating a reference to the skalli family."
101851.jpg,"the image features a sleek asus zenwatch with a leather strap, showcasing its modern design and features."
101852.jpg,"a crowded stadium filled with fans, featuring a large banner reading "" generale club "" above the entrance."
101853.jpg,a sony ericsson mobile phone displays a list of various mobile phones available for purchase.
101854.jpg,"a modern bus with a colorful design, featuring a large window and a sleek design, suitable for public transportation."
101855.jpg,"two men in blue baseball uniforms converse on the field. one wears a cap, the other a light blue jersey."
101856.jpg,"a row of yellow taxis is parked along a city street, showcasing various colors and markings."
101857.jpg,"a blue billboard displays "" the hotel california, "" dated 1970, with yellow text indicating it is a motel."
101858.jpg,"a man in a suit stands in front of a computer monitor displaying a presentation, with a silhouette of a person nearby."
101859.jpg,a large group of birds flies beneath a large hang glider against a clear blue sky.
101860.jpg,"a plate of fish and chips with a coca - cola can beside it, accompanied by a drink and a can."
101861.jpg,"the image features several colorful cans of yona yona tea, showcasing various flavors and designs, arranged in a row."
101862.jpg,"a poster featuring a woman speaking into a microphone, promoting a concert titled "" we all must lost, "" with bold text."
101863.jpg,"a coffee grinder sits on a counter, with a cup of coffee and a grinder nearby, indicating a coffee shop setting."
101864.jpg,"the image shows a pantry shelf filled with various food items, including jars, sauces, and condiments."
101865.jpg,"a vibrant mural and graffiti wall under a glass roof, with people walking nearby and a parked vehicle visible."
101866.jpg,a close - up of a htc mobile phone displaying a green screen with text messages and a notification.
101867.jpg,"a can of diet coke sits on a wooden desk, with a computer keyboard and mouse in the background."
101868.jpg,"the image shows a vintage store interior with shelves filled with various toys, including a display of various items."
101869.jpg,"a bright yellow blender with a clear pitcher, featuring a measurement scale and a control knob for blending."
101870.jpg,"a football match scene with players in green and red uniforms, a crowd of fans in the background, and a referee leading the way."
101871.jpg,"a hand holds a box of viridum gum, featuring a colorful design, with a shopping basket in the background."
101872.jpg,"a smiling man sits on a red bench, surrounded by organized boxes and a variety of shoes."
101873.jpg,"a shelf filled with various books, including titles on finance, politics, and management, showcasing diverse genres and colors."
101874.jpg,"modern buildings with large towers, surrounded by greenery and a grassy area, under a bright sky."
101875.jpg,"a traffic sign displays a red circle with a white stripe, alongside a blue sign that reads "" rue de la liberte. """
101876.jpg,"a historic building with a grand facade, surrounded by greenery and parked vehicles, under a clear blue sky."
101877.jpg,"a glass of amber beer beside a bottle of innis - gun original, showcasing a rich amber color and frothy head."
101878.jpg,"a person holds a nikon camera, focusing on a screen displaying a scenic view, with greenery in the background."
101879.jpg,"the image features a vintage advertisement for the ulma polish, showcasing a compact polisher with a vibrant red design."
101880.jpg,"a pitcher in a gray phillies uniform prepares to throw, while teammates and spectators watch from the stands."
101881.jpg,a baseball player in a white uniform with the number 22 prepares to pitch on a field.
101882.jpg,"a convenience store shelf displays various cleaning products, including bottles and containers, organized neatly."
101883.jpg,"a traffic sign displays a red circle with a tractor icon, indicating no parking for pedestrians."
101884.jpg,"a handwritten note on a green notebook page lists "" setters "" and "" homework journal, "" with a date and a green background."
101885.jpg,the image displays a computer monitor showing a starbucks transaction screen with a starbucks coffee cup and a starbucks logo.
101886.jpg,"the image features a book cover titled "" the definitive reproductive guide, "" highlighting 90 albums of the 90 ' s."
101887.jpg,"a vibrant display of colorful comic - themed posters and promotional materials, featuring a television screen and vibrant graphics."
101888.jpg,"the image shows a scoreboard at a sports event, displaying the game details and the date "" get loud, "" with a vibrant red background."
101889.jpg,"a baseball game scene with players in uniforms, a umpire, and a crowd cheering in the background."
101890.jpg,"a woman smiles while interacting with a man at a booth, surrounded by various merchandise displays and people in the background."
101891.jpg,"the image features the cover of "" cover - up at ann arbor, "" a book by harry haines, showcasing a damaged aircraft."
101892.jpg,"a spacious convenience store interior with shelves stocked with various products, featuring a prominent "" school day "" sign."
101893.jpg,"a large airplane, marked with "" iamatica, "" is landing on a snowy runway, surrounded by winter scenery."
101894.jpg,"a hand reaches for a bottle inside a modern refrigerator, showcasing the time and temperature of the fridge."
101895.jpg,a person holds a sony ericsson xperia mobile phone displaying a video game scene with a character in action.
101896.jpg,"the image shows an open book page with text in a medieval style, featuring a detailed initial letter and decorative elements."
101897.jpg,"the image shows a computer monitor displaying a webpage for "" freetimeing the firenza "" with a prompt for opening a fire tv."
101898.jpg,"a vintage christmas postcard featuring a man in winter attire delivering mail, with a snowy landscape and a snowy village."
101899.jpg,"a person holds a stainless steel watch with a black face, featuring white numerals and a date display."
