image_id,caption
102745.jpg,"a vintage streetcar is parked at a gas station, surrounded by cars and a gas station in the background."
102746.jpg,"a detailed model of a military aircraft, featuring a gray body and distinctive markings, displayed on a surface."
102747.jpg,a young man in a blue chelsea football jersey runs on a green field during a match.
102748.jpg,"a vintage computer with a sleek design, featuring a keyboard and a small display screen, ideal for office use."
102749.jpg,"two yellow school buses are parked side by side, labeled "" school bus "" and "" bus driver ""."
102750.jpg,"a boat glides through clear water near an ornate building, showcasing historical architecture and a clear blue sky."
102751.jpg,"a man in a baseball uniform pitches on a field, wearing a glove and sports footwear."
102752.jpg,"a man in a suit speaks at a podium, with a clock and a book nearby. a coffee cup is present."
102753.jpg,"a statue of a man holding a flag stands beside a clock, with greenery and a building in the background."
102754.jpg,"a vintage poster featuring a woman with steampunk hair, promoting champion clos lump starch with a cornucylon."
102755.jpg,"a frying pan filled with fried worms, surrounded by bottles of pepsi and a glass of water."
102756.jpg,"a man in an orange and blue sports uniform poses confidently, showcasing a casual and sporty look."
102757.jpg,"four bottles of huckleburg root beer are displayed on a countertop, showcasing their distinctive labels and amber glass."
102758.jpg,"the image shows the internal components of a mobile phone, including a battery and sim card slots."
102759.jpg,"a bottle of pure blonde premium beer is prominently displayed on a table, with condensation visible on the glass."
102760.jpg,"the image shows an open book with text on two pages, featuring sections about and about women ' s lives."
102761.jpg,"a large passenger boat named "" cast fancy victory "" navigates the water, with a city skyline in the background."
102762.jpg,"a packed stadium during a football game, featuring a large field and a checkered pattern on the field."
102763.jpg,"a bottle of bernard svatecni lager next to a glass filled with golden beer, showcasing a refreshing drink."
102764.jpg,"a brown glass bottle of ballast point brewing company ' s "" fathom "" beer, featuring a colorful label with a cartoonish character."
102765.jpg,"the image features a vintage advertisement for a perfume, showcasing a smiling man and a bottle of giustoria, highlighting its elegance."
102766.jpg,two sony ericsson mobile phones are displayed side by side on a patterned surface. one is black and the other is black.
102767.jpg,"a breitling watch with a black dial, silver case, and chronograph functions, held in a hand."
102768.jpg,"two men in baseball uniforms converse on the field. one wears a blue jersey with "" t. f. "" and the other has "" frankenstein "" on"
102769.jpg,"a colorful poster featuring bold text that reads "" todo sobre mi madre "" in bold, modern typography."
102770.jpg,"a bottle of wine labeled "" bourgogne clos du marape, "" resting on a wooden surface."
102771.jpg,"two men converse on a baseball field, with a large mural in the background and a baseball field scene nearby."
102772.jpg,"the image features a poster for the "" floralis generalia "" exhibition, showcasing artistic sculptures against a clear blue sky."
102773.jpg,"a large wall clock displays the time, alongside a sign reading "" sins observe the time and pay for all times. """
102774.jpg,"a bottle of sebastiani chardonnay 2012 from sonoma county, showcasing its elegant design and vintage."
102775.jpg,"a bottle of saison beer is prominently displayed on a shelf, surrounded by other bottles in a storage area."
102776.jpg,"a laptop displays a colorful illustration of two men on a motorcycle, with a cart in the foreground."
102777.jpg,"the image features four perfume bottles : a clear bottle, a small bottle, a small bottle, and a smaller bottle, all labeled "" honey """
102778.jpg,"a red vehicle with a "" 2eq gavop "" sticker and a green star insignia, parked among other vehicles."
102779.jpg,"the image shows a newspaper article discussing the death of an unknown person, dated december 12, 2010."
102780.jpg,"the image shows a clothing store entrance with a "" the scrub shop "" sign and various clothing items displayed."
102781.jpg,"a weathered stop sign stands beside a weathered road sign for rambo rd, with a yellow caution sign below."
102782.jpg,"digital watch displaying time as 3 : 15 : 00, date as friday, august 15, and temperature at 3 : 34."
102783.jpg,"a well - stocked convenience store aisle with various beauty products and products displayed, featuring a health section."
102784.jpg,"a vending machine displays various mobile phones, with illuminated buttons and a stone wall in the background."
102785.jpg,"a man in a black sports uniform pitches a baseball on a baseball field, with spectators in the background."
102786.jpg,"a stack of books, including titles on writing and art, is displayed with a visible binding tool."
102787.jpg,"a gold coin featuring a lion emblem, inscribed with "" united states of america "" and "" united states of latin america. """
102788.jpg,"a vintage book cover titled "" n. tions unlimited "" by robert chickley, featuring a red background with a dynamic illustration of a figure."
102789.jpg,"a person is wearing black trousers with "" juicy "" printed on them, paired with a red top and beige footwear."
102790.jpg,"a mobile phone displays a news article, resting on a newspaper featuring a political message about the new jersey state senate."
102791.jpg,"a close - up of a silver sony headphones, featuring black accents and a sleek design, positioned on a white background."
102792.jpg,"a baseball player in a gray uniform throws a pitch, wearing a red cap and cleats on the field."
102793.jpg,"a green victorian - style house with white trim, featuring large windows, a decorative staircase, and lush greenery."
102794.jpg,"a pedestrian crosses the street near a brightly lit building labeled "" amg imax, "" with traffic lights visible."
102795.jpg,"a close - up of a luxury watch featuring a black dial, luminous hands, and a blue background."
102796.jpg,"a sign welcomes visitors to the school, welcoming visitors to the school year. it includes a cycling symbol and a cycling symbol."
102797.jpg,"a black boat with a crew member signals while navigating through turbulent waters, showcasing marine equipment and equipment."
102798.jpg,"three men stand together, smiling, wearing uniforms, with a map in the background. they are in a kitchen setting."
102799.jpg,"the whiteboard displays mathematical equations and functions, including the formula and function, with colored markers and notes."
102800.jpg,"a laptop displays a magazine titled "" scala, "" featuring a glass graphic on the cover."
102801.jpg,"the image features various papers, including a book titled "" promoting your podcast, "" and various promotional materials."
102802.jpg,"the image shows a cd cover featuring the band "" angel ' s shadows, "" with a colorful background and artwork of the band."
102803.jpg,"a laptop displays a webpage, with a drink can and office supplies in the background."
102804.jpg,"a shiny coin with a raised edge, featuring a design on the surface, resting on a red surface."
102805.jpg,"a vintage poster promoting "" town club beer "" with bold red text and an international revenue paid logo."
102806.jpg,"a glass of frogger beer sits on a table, with two bottles blurred in the background."
102807.jpg,"the image features various beer and wine boxes, including ales and spirits, arranged on a wooden table."
102808.jpg,"billboard displaying the unidade penha logo, promoting a community meeting on september 24, 2014, at the national stadium."
102809.jpg,"the image displays a collection of comic books, including titles like "" supergirl, "" "" dc, "" and "" the dark knight saga. """
102810.jpg,a large wall clock displays the time above a train schedule board at a station.
102811.jpg,"digital clock displays the time as 8 : 54 pm, with a blue outline design on a dark background."
102812.jpg,"a silver tin can labeled "" boss clearpress, "" featuring a red stripe and a graphic of a man."
102813.jpg,"the image features several books, including titles like "" la reine des rues, "" "" renois, "" and "" la reine des rue"
102814.jpg,"a glass coffeemaker with a clear bowl holds a dark coffee, showcasing its steam and a pink base."
102815.jpg,"a vintage superman watch features a colorful design with bold text and a superhero figure, set against a colorful background."
102816.jpg,"a gray honda car displays a virginia license plate reading "" woof wuf "" with a prominent arrow."
102817.jpg,"a white van with a company logo is parked, while a person inspects its hood. windows are visible in the background."
102818.jpg,"the image features several jars of "" luxe butter "" with gold lids, showcasing various labels and designs."
102819.jpg,"a coin from the republic of honduras, featuring a central portrait and the inscription "" republica de honduras. """
102820.jpg,"the image shows a portable audio recorder with accessories, a cd, and a manual for the at & t max service."
102821.jpg,the image displays two mobile phones side by side : a black iphone and a white iphone with a touchscreen.
102822.jpg,"construction site with cranes, including a large building complex and "" the best of all time "" billboard."
102823.jpg,"the image features a casio digital watch displaying the time as 14 : 43, showcasing a sleek design and vibrant colors."
102824.jpg,"a coffee station with a coffee maker, cups, and a shelf displaying various cups and sauces."
102825.jpg,"three colorful high - heeled shoes displayed on a glass shelf, featuring clear straps and clear platforms."
102826.jpg,"a basketball team poses for a team photo, wearing blue sports uniforms, with a basketball in front of them."
102827.jpg,"a seiko quartz watch is displayed alongside a black leather case, showcasing a stylish design and detailed features."
102828.jpg,"a field hockey match is underway, featuring players in striped jerseys and a ball on a green field."
102829.jpg,"the image features colorful place cards with cartoon birds, labeled "" esc, "" "" man, "" and "" muscas, "" set on a"
102830.jpg,a nokia mobile phone displays a colorful windows interface with various app tiles on its screen.
102831.jpg,"a football player in a red jersey dribbles the ball, surrounded by teammates and opponents on the field."
102832.jpg,"a vintage olivetti typewriter with a beige body and black keys, showcasing classic office supplies."
102833.jpg,"a military aircraft is parked on the tarmac, with a service vehicle and personnel nearby."
102834.jpg,"a rugby match is in progress, with players in uniforms and a referee preparing for the game."
102835.jpg,"a red coast guard boat is in calm waters, surrounded by smaller vessels and a larger vessel in the background."
102836.jpg,"a man holds a camera, surrounded by colorful rubber ducks on a table, in a room filled with various items."
102837.jpg,"a red stop sign is prominently displayed at the intersection of summit street, with a street sign for "" spooner st. """
102838.jpg,"billboard promoting the at & t mobile world website, featuring bold text and an orange background promoting the mobile world."
102839.jpg,"a yellow and black helicopter is parked on a runway, with a clear sky and distant clouds in the background."
102840.jpg,a digital clock displays the time as 15 : 35 in bright red numbers on a dark background.
102841.jpg,"the image shows a display of cold milk bottles labeled "" cold milk "" in a convenience store setting."
102842.jpg,"a yellow traffic sign reads "" end, "" indicating a road ahead, with a red warning sign below."
102843.jpg,"three blue and green mailboxes stand side by side against a brick wall, labeled for "" 99 arch street. """
102844.jpg,"a yellow traffic sign indicates "" no parking time "" and "" watch for senior citizens, "" indicating a parking area."
102845.jpg,"three players compete in a floorball match, wearing red and black jerseys, with one player dribbling the ball."
102846.jpg,"the image shows a clothing store with shelves displaying various apparel items, including jackets and accessories, and a sign reading "" autumn express storage. """
102847.jpg,"a military aircraft is displayed, featuring a detailed design and the inscription "" united states of america "" on its fuselage."
102848.jpg,"the image features a movie poster for "" the dark tower, "" showcasing a dramatic image of a man with long hair and a red circular logo."
102849.jpg,"the image is a promotional poster for a music event featuring a young man in a stylish outfit, with vibrant graphics and text."
102850.jpg,"a vibrant yellow vintage car with chrome accents, showcasing its classic design and classic styling."
102851.jpg,"a mobile phone displays a music app for "" shaffiff play, "" while a cyclist rides in the background."
102852.jpg,"a laptop displays a blue screen with a message about a system update, placed on a desk."
102853.jpg,"the image shows a bronze coin with the inscription "" united states of manhattan avenue "" and "" on on od, "" dated august 9, 2001."
102854.jpg,"a pedestrian symbol and a sign indicate a social environment, with a message about gender equality and gender rights."
102855.jpg,"a red telephone booth with a sign reading "" telephone "" and a contact number, located in a city setting."
102856.jpg,"a person holds a mobile phone displaying a report about the bomb, including references and a website link."
102857.jpg,"a wooden bookcase displays various books, including "" the complete sherlock holmes "" and "" sherlock holmes and the dark knight. """
102858.jpg,"a bottle of red wine labeled "" noarzog, "" featuring a camouflage design, placed on a table."
102859.jpg,"a display of blue glass bottles with straws, labeled "" quirkymen special ' s "" and prices listed."
102860.jpg,"a woman in a blue sports uniform stands on a sandy beach, preparing to play volleyball."
102861.jpg,"a woman in a black shirt and white pants interacts with a man in a sports uniform, both engaging with each other."
102862.jpg,"a vintage magazine cover titled "" detective stories, "" featuring a woman in a yellow dress and a man in a suit, with a gun."
102863.jpg,"a large, green and beige tent with two windows, featuring a side door and a side entrance."
102864.jpg,"a coffee cup with a latte art design sits on an orange saucer, showcasing a coffee drink."
102865.jpg,the image shows a grocery store shelf with various bags of rice and packaged food items.
102866.jpg,a woman in a colorful dress holds a tray of fruits beside two modern refrigerators in a bright kitchen setting.
102867.jpg,"poster promoting the ghost towns of route 66, detailing attractions and scenic attractions in the ghost towns area."
102868.jpg,"a promotional poster for "" dynamic fighters, "" featuring fighters in action, with a vibrant background and various stickers."
102869.jpg,"a bottle of 2010 wine labeled "" chablis, "" featuring a simple design and a green cap."
102870.jpg,"the image displays two mobile phones, one showing the best phone deals app for $ 9. 99."
102871.jpg,"the image features a display of a book titled "" ruin college, "" showcasing various photos and text related to a school or community."
102872.jpg,"a woman holds an lg mobile phone, showcasing its touchscreen display and various app icons in a store setting."
102873.jpg,a taxi is parked near a busy street with protest signs and a taxi in the foreground.
102874.jpg,"a young male athlete in a black and yellow sports uniform celebrates victory, surrounded by teammates in a wrestling match."
102875.jpg,"four cheerleaders in matching uniforms perform energetically, showcasing their energetic movements and joy during a sports event."
102876.jpg,"two bottles of miller genuine draft beer are partially buried in snow, showcasing their golden liquid and distinctive labels."
102877.jpg,"a round coin featuring the number 1 and the inscription "" 1, "" with a textured background."
102878.jpg,"a cozy outdoor setting features people seated at tables, with a candle and a glass of water on the table."
102879.jpg,"a decorated cake featuring red, black, and white polka dots, with a unique name tag and a graduation cap."
102880.jpg,"a heineken beer bottle stands on a table, with a remote control nearby."
102881.jpg,a football match scene with players in yellow and black jerseys competing for the ball on a grassy field.
102882.jpg,"the image displays a selection of various watches, highlighting their colorful designs and features."
102883.jpg,"a close - up of a pilny elder beer bottle, showcasing its label and golden liquid, against a blurred background."
102884.jpg,"a baseball player in a white uniform throws a ball on the field, showcasing athleticism and focus."
102885.jpg,"a hand points to a black die labeled "" supreme court of the united states, "" set against a wooden table."
102886.jpg,"a collection of various coins, including pennies and dimes, organized in a black box."
102887.jpg,"a vintage steam train with a large, steam - powered locomotive, emitting smoke, set on tracks near a building."
102888.jpg,"a storefront named "" hoxtons bazaar, "" featuring a green sign and colorful displays of products. yellow leaves are scattered on the ground."
102889.jpg,"a black nokia mobile phone is shown from the back, featuring a smooth surface and a visible camera lens."
102890.jpg,"a wrestler celebrates with a championship belt, wearing a black shirt and shorts, in a wrestling ring."
102891.jpg,"a police van with blue and yellow markings parked on a street, featuring a light bar on top."
102892.jpg,"a basketball player in a green uniform shoots the ball while opponents defend, with spectators in the background."
102893.jpg,a white mobile phone is displayed in a clear plastic case on a wooden surface.
102894.jpg,"a jar of vegemite capsules, labeled "" herbal yeast, "" sits on a table, with a box in the background."
102895.jpg,"the image features a traffic sign indicating a 10 - min distance to place cards, with a snowy backdrop and trees in the background."
102896.jpg,"two horror movie posters : "" the monkey ' s eye "" and "" the single detective, "" featuring dramatic imagery and bold text."
102897.jpg,"three green boxes of medication are displayed on a reflective surface, labeled with different sizes and specifications."
102898.jpg,"an open notebook page features handwritten notes and a date, labeled "" teaching day, "" dated december 1, 2008."
102899.jpg,"the image shows a television displaying a countdown timer for a race, with a countdown timer showing 00 : 22."
102900.jpg,"the image shows a tool bench with a viset, a tool for cutting metal parts, and a label reading "" tool rest. """
102901.jpg,"two mobile phones are displayed side by side on a wooden surface. one is black and the other is white, showcasing a touchscreen interface."
102902.jpg,"the image features two bottles of pepsi and sports drinks, including a drink labeled "" drink extra "" and a sports drink."
102903.jpg,"a muscular man in a sports uniform celebrates, raising his arms in celebration, surrounded by fans."
102904.jpg,"a black tin can labeled "" rockstar energy drink, "" featuring a logo and star design elements."
102905.jpg,"a bright yellow van is parked on grass, showcasing its classic design and large windows."
102906.jpg,"a colorful mural featuring a camera and various symbols, with text indicating "" dixons "" and "" start living in peace. """
102907.jpg,"a vibrant neon sign displays "" the beach "" with a beach theme, featuring a sun and a boat, promoting an outdoor vibe."
102908.jpg,"a black laptop with a visible keyboard is placed on a table, partially open, revealing a protective cover."
102909.jpg,"a television displays a news broadcast with a woman in a white suit, and a train station backdrop."
102910.jpg,"a jar of vintage fall ' s monkey fruit jam, labeled "" monster ' s jam, "" with a decorative design."
102911.jpg,"a smiling woman in a black dress stands near yellow taxis, holding a bag, in a busy city street."
102912.jpg,"a bottle of stout beer stands beside a glass filled with golden beer, showcasing a frothy head."
102913.jpg,"a close - up of a white samsung mobile phone, showcasing its back design and camera."
102914.jpg,"a vintage wall clock featuring a winged figure holding a trumpet, with roman numerals and a classic design."
102915.jpg,"a bottle of cointreau liqueur, labeled "" four quartro, "" with a price of $ 1. 95."
102916.jpg,"a yellow and white aircraft is flying, showcasing its distinctive design and registration number n788dr."
102917.jpg,"a colorful poster featuring lego characters from "" star wars, "" with a galactic background and vibrant lights."
102918.jpg,"an airbus a380 aircraft is approaching for landing, showcasing its large wingspan and distinctive branding."
102919.jpg,"a row of green bottles of fanta, a flavored soft drink, displayed on a shelf."
102920.jpg,"a yellow and green train engine labeled "" gmms pure ready "" is parked near a rural area with mountains in the background."
102921.jpg,"a bottle of brut wine, labeled "" brut, "" featuring a white label with a green emblem and a yellow cap."
102922.jpg,"a man in a suit speaks at a podium, with a backdrop featuring a cityscape and event details."
102923.jpg,"a bright convenience store entrance featuring a red sign, promotional displays, and a police officer in uniform."
102924.jpg,"a large airplane is parked at a shipping yard, loaded with cargo and a large cargo carrier nearby."
102925.jpg,"an open book displays text in two columns, featuring a passage about the history of the united states and its influence on american history."
102926.jpg,"a large sailing boat with white sails and multiple sails glides through calm waters, surrounded by clouds."
102927.jpg,"a poster welcomes students to bridgewater school, featuring various subjects and their names in bright colors."
102928.jpg,"a white mug features a small square face with a face expression, with a gradient colored edge."
102929.jpg,"a brown beer bottle labeled "" backlash raster company, "" showcasing a skull graphic and the brand name "" out break. """
102930.jpg,two wall clocks are displayed side by side : one features a white face with blue accents and the other features a black clock with roman numerals.
102931.jpg,"a man stands in front of a soccer field, wearing a white shirt and black shorts, with a welcome sign nearby."
102932.jpg,"four beer bottles are displayed, featuring distinct labels from various brewerys, including stone and black ipa."
102933.jpg,"a boy in a blue sports uniform runs towards home plate, while another boy in a black baseball glove approaches."
102934.jpg,"a bustling street scene at night features colorful billboards, pedestrians, and illuminated store signs, creating a lively atmosphere."
102935.jpg,"a road with a traffic sign indicating a 25 km / h speed limit, surrounded by greenery."
102936.jpg,"a woman in a colorful, plaid - style dress dances, wearing black boots and a red scarf, with a promotional backdrop."
102937.jpg,"a collection of various aircraft is scattered on the ground, including a small helicopter and a smaller aircraft."
102938.jpg,"a red train labeled "" thathys "" is stationed at a station, with overhead lines and a train in the background."
102939.jpg,"a round wall clock with a black frame displays black numbers and hands, showing the time clearly."
102940.jpg,"three yellow and red waste containers are stacked, each with a prominent logo on the top."
102941.jpg,"a player in a white sports uniform with maroon accents stands at home plate, ready to bat."
102942.jpg,"a whiteboard displays a diagram illustrating "" dialogue diagrams, "" featuring connections between different topics and topics."
102943.jpg,"a framed notice from the "" atomic hydroxide, "" detailing its impact on radiation, emphasizing its impact on radiation levels."
102944.jpg,"a busy city street features tall buildings, a taxi, and large billboards advertising various businesses."
102945.jpg,"a framed painting of a woman holding a child, surrounded by greenery, depicts a woman holding a child."
102946.jpg,"a young man sits at a table with two laptops, displaying a presentation, in a tent setting."
102947.jpg,"the image displays a computer monitor showing a financial statement about a project called "" onsided, "" with details about project details and budget details."
102948.jpg,"the image features the book "" echo round his bones "" by thomas m. disich, showcasing a vibrant cover with abstract graphics."
102949.jpg,"a variety of raw meat pieces are displayed on a countertop, alongside a metal pot and a bottle of water."
102950.jpg,"modern building with a large entrance, featuring a large staircase and glass entrance, set against a clear sky."
102951.jpg,"a group of baseball players in blue uniforms gathers on the field, preparing for a game."
102952.jpg,a young man in a red and black sports uniform throws a yellow soccer ball on a grassy field.
102953.jpg,"a white van is parked on a sidewalk, with a street lamp nearby and buildings in the background."
102954.jpg,"a woman with long hair sings into a microphone, promoting the 3 national awards for excellence in music."
102955.jpg,"a framed poster featuring a basketball player dunking, showcasing his sports uniform and basketball, with a wooden background."
102956.jpg,"a public payphone with a digital screen, featuring a payphone and a ticket machine for payment."
102957.jpg,"a display of assorted items, including hats and scarves, at a market stall labeled "" jet runner. """
